[
  {
    "agent_id": "artifact_workspace_fresh_readiness",
    "bucket": "artifact_workspace",
    "run_date": "2026-03-30",
    "status": "ok",
    "records": [
      {
        "source_id": "src_doc_95c4bda555e0",
        "title": "Introducing the Codex app",
        "canonical_url": "[https://openai.com/index/introducing-the-codex-app/](https://openai.com/index/introducing-the-codex-app/)",
        "date": "2026-02-02",
        "authors_or_org": [
          "OpenAI"
        ],
        "source_type": "engineering_writeup",
        "artifact_type": "webpage",
        "time_window_status": "primary_window",
        "exception_reason": null,
        "bucket_primary": "artifact_workspace",
        "bucket_secondary": [
          "topology"
        ],
        "decision_targets": [
          "artifacts_workspace",
          "topology",
          "recovery"
        ],
        "mechanism_tags": [
          "git_worktrees",
          "isolated_checkouts",
          "parallel_agent_isolation",
          "thread_scoped_changes",
          "resume_by_project_thread"
        ],
        "failure_mode_tags": [],
        "benchmark_tags": [],
        "benchmark_contamination_risk": "low",
        "task_regime": [
          "terminal_agent",
          "coding_agent",
          "mixed"
        ],
        "models_if_named": [],
        "environment_type": [
          "sandboxed_terminal",
          "local_fs",
          "mixed"
        ],
        "evidence_scorecard": {
          "provenance": 5,
          "mechanistic_detail": 3,
          "reproducibility": 3,
          "ecological_validity": 4,
          "decision_relevance": 4,
          "recency": 5
        },
        "relevance_note": "Official product writeup with explicit worktree isolation for parallel agents.",
        "reason_included": "Concrete isolated-workspace mechanism from a primary source.",
        "claim_snippets": [
          {
            "claim_id": "c1",
            "claim_text": "Codex app agents work in built-in worktrees so each agent operates on an isolated copy of the codebase rather than the user's live checkout.",
            "claim_status": "asserted"
          },
          {
            "claim_id": "c2",
            "claim_text": "Threads are organized by project and let the user switch between long-running tasks without losing the changes associated with that thread.",
            "claim_status": "asserted"
          }
        ],
        "claim_locations": [
          {
            "claim_id": "c1",
            "locator": "OpenAI product post, section 'Review changes safely', lines 51-52"
          },
          {
            "claim_id": "c2",
            "locator": "OpenAI product post, section 'Work with multiple agents in parallel', lines 39-41"
          }
        ],
        "dedupe_key": "[https://openai.com/index/introducing-the-codex-app/](https://openai.com/index/introducing-the-codex-app/)"
      },
      {
        "source_id": "src_doc_1015c73f2032",
        "title": "Unlocking the Codex harness: how we built the App Server",
        "canonical_url": "[https://openai.com/index/unlocking-the-codex-harness/](https://openai.com/index/unlocking-the-codex-harness/)",
        "date": "2026-02-04",
        "authors_or_org": [
          "OpenAI"
        ],
        "source_type": "engineering_writeup",
        "artifact_type": "webpage",
        "time_window_status": "primary_window",
        "exception_reason": null,
        "bucket_primary": "artifact_workspace",
        "bucket_secondary": [
          "observability",
          "state",
          "recovery"
        ],
        "decision_targets": [
          "artifacts_workspace",
          "observability",
          "state",
          "recovery"
        ],
        "mechanism_tags": [
          "checked_out_workspace",
          "workspace_diffs",
          "persisted_event_history",
          "server_side_resume",
          "containerized_runtime"
        ],
        "failure_mode_tags": [],
        "benchmark_tags": [],
        "benchmark_contamination_risk": "low",
        "task_regime": [
          "terminal_agent",
          "coding_agent",
          "mixed"
        ],
        "models_if_named": [],
        "environment_type": [
          "sandboxed_terminal",
          "docker",
          "mixed"
        ],
        "evidence_scorecard": {
          "provenance": 5,
          "mechanistic_detail": 4,
          "reproducibility": 3,
          "ecological_validity": 5,
          "decision_relevance": 5,
          "recency": 5
        },
        "relevance_note": "Primary engineering doc for persisted workspaces, diffs, and resume behavior.",
        "reason_included": "Directly specifies auditable state and workspace continuity mechanics.",
        "claim_snippets": [
          {
            "claim_id": "c1",
            "claim_text": "The App Server surfaces workspace exploration, progress streaming, and diffs on top of the underlying agent loop.",
            "claim_status": "asserted"
          },
          {
            "claim_id": "c2",
            "claim_text": "Codex persists event history server-side and supports create, resume, fork, and archive operations on threads, giving a stable timeline for past work.",
            "claim_status": "asserted"
          },
          {
            "claim_id": "c3",
            "claim_text": "A checked-out workspace runs in a container, and saved thread sessions let a later session reconnect and continue from the previous workspace state.",
            "claim_status": "asserted"
          }
        ],
        "claim_locations": [
          {
            "claim_id": "c1",
            "locator": "Engineering post, overview of App Server responsibilities, lines 46-47 and 66"
          },
          {
            "claim_id": "c2",
            "locator": "Engineering post, section on thread lifecycle and event history, lines 54-76"
          },
          {
            "claim_id": "c3",
            "locator": "Engineering post, client integration discussion, lines 215-216"
          }
        ],
        "dedupe_key": "[https://openai.com/index/unlocking-the-codex-harness/](https://openai.com/index/unlocking-the-codex-harness/)"
      },
      {
        "source_id": "src_doc_4b5ef2719693",
        "title": "Codex Prompting Guide",
        "canonical_url": "[https://developers.openai.com/cookbook/examples/gpt-5/codex_prompting_guide/](https://developers.openai.com/cookbook/examples/gpt-5/codex_prompting_guide/)",
        "date": "2026-02-25",
        "authors_or_org": [
          "OpenAI"
        ],
        "source_type": "official_doc",
        "artifact_type": "webpage",
        "time_window_status": "primary_window",
        "exception_reason": null,
        "bucket_primary": "artifact_workspace",
        "bucket_secondary": [
          "context",
          "cost_budget"
        ],
        "decision_targets": [
          "context",
          "artifacts_workspace",
          "cost_budget"
        ],
        "mechanism_tags": [
          "agents_md_injection",
          "directory_scoped_guidance",
          "root_to_leaf_merge",
          "size_capped_instruction_chain",
          "context_compaction"
        ],
        "failure_mode_tags": [],
        "benchmark_tags": [],
        "benchmark_contamination_risk": "low",
        "task_regime": [
          "terminal_agent",
          "coding_agent"
        ],
        "models_if_named": [
          "gpt-5.3-codex"
        ],
        "environment_type": [
          "sandboxed_terminal",
          "local_fs"
        ],
        "evidence_scorecard": {
          "provenance": 5,
          "mechanistic_detail": 4,
          "reproducibility": 4,
          "ecological_validity": 4,
          "decision_relevance": 5,
          "recency": 5
        },
        "relevance_note": "Official guidance for directory-scoped control files and compaction behavior.",
        "reason_included": "Provides explicit file naming and merge-order rules.",
        "claim_snippets": [
          {
            "claim_id": "c1",
            "claim_text": "Codex CLI automatically enumerates AGENTS.md files and injects their contents into the model context.",
            "claim_status": "asserted"
          },
          {
            "claim_id": "c2",
            "claim_text": "Instruction files are pulled from ~/.codex plus each directory from the repo root down to the current working directory, and later directories override earlier ones.",
            "claim_status": "asserted"
          },
          {
            "claim_id": "c3",
            "claim_text": "Conversation state can be compacted into encrypted_content to preserve important context with lower token cost.",
            "claim_status": "asserted"
          }
        ],
        "claim_locations": [
          {
            "claim_id": "c1",
            "locator": "Cookbook, AGENTS.md guidance, lines 602-608"
          },
          {
            "claim_id": "c2",
            "locator": "Cookbook, AGENTS.md precedence rules, lines 604-616"
          },
          {
            "claim_id": "c3",
            "locator": "Cookbook, compaction discussion, lines 617-625"
          }
        ],
        "dedupe_key": "[https://developers.openai.com/cookbook/examples/gpt-5/codex_prompting_guide/](https://developers.openai.com/cookbook/examples/gpt-5/codex_prompting_guide/)"
      },
      {
        "source_id": "src_doc_afbd4293bcd8",
        "title": "Codex changelog",
        "canonical_url": "[https://developers.openai.com/codex/changelog/](https://developers.openai.com/codex/changelog/)",
        "date": "2026-03-18",
        "authors_or_org": [
          "OpenAI"
        ],
        "source_type": "official_doc",
        "artifact_type": "docs_page",
        "time_window_status": "primary_window",
        "exception_reason": null,
        "bucket_primary": "artifact_workspace",
        "bucket_secondary": [
          "tool_gateway",
          "recovery",
          "observability"